No.     Time        Source                Destination           Protocol Info
      1 0.000000    10.0.2.15             209.2.227.225         TCP      48420 > http [SYN] Seq=0 Win=14600 Len=0 MSS=1460 SACK_PERM=1 TSV=155006 TSER=0 WS=7

Frame 1: 74 bytes on wire (592 bits), 74 bytes captured (592 bits)
    Arrival Time: Mar  1, 2013 21:08:17.681515000 EST
    Epoch Time: 1362190097.681515000 seconds
    [Time delta from previous captured frame: 0.000000000 seconds]
    [Time delta from previous displayed frame: 0.000000000 seconds]
    [Time since reference or first frame: 0.000000000 seconds]
    Frame Number: 1
    Frame Length: 74 bytes (592 bits)
    Capture Length: 74 bytes (592 bits)
    [Frame is marked: False]
    [Frame is ignored: False]
    [Protocols in frame: eth:ip:tcp]
    [Coloring Rule Name: HTTP]
    [Coloring Rule String: http || tcp.port == 80]
Ethernet II, Src: CadmusCo_b5:93:71 (08:00:27:b5:93:71), Dst: RealtekU_12:35:02 (52:54:00:12:35:02)
    Destination: RealtekU_12:35:02 (52:54:00:12:35:02)
        Address: RealtekU_12:35:02 (52:54:00:12:35:02)
        .... ...0 .... .... .... .... = IG bit: Individual address (unicast)
        .... ..1. .... .... .... .... = LG bit: Locally administered address (this is NOT the factory default)
    Source: CadmusCo_b5:93:71 (08:00:27:b5:93:71)
        Address: CadmusCo_b5:93:71 (08:00:27:b5:93:71)
        .... ...0 .... .... .... .... = IG bit: Individual address (unicast)
        .... ..0. .... .... .... .... = LG bit: Globally unique address (factory default)
    Type: IP (0x0800)
Internet Protocol, Src: 10.0.2.15 (10.0.2.15), Dst: 209.2.227.225 (209.2.227.225)
    Version: 4
    Header length: 20 bytes
    Differentiated Services Field: 0x10 (DSCP 0x04: Unknown DSCP; ECN: 0x00)
        0001 00.. = Differentiated Services Codepoint: Unknown (0x04)
        .... ..0. = ECN-Capable Transport (ECT): 0
        .... ...0 = ECN-CE: 0
    Total Length: 60
    Identification: 0xc577 (50551)
    Flags: 0x02 (Don't Fragment)
        0... .... = Reserved bit: Not set
        .1.. .... = Don't fragment: Set
        ..0. .... = More fragments: Not set
    Fragment offset: 0
    Time to live: 64
    Protocol: TCP (6)
    Header checksum: 0xb441 [correct]
        [Good: True]
        [Bad: False]
    Source: 10.0.2.15 (10.0.2.15)
    Destination: 209.2.227.225 (209.2.227.225)
Transmission Control Protocol, Src Port: 48420 (48420), Dst Port: http (80), Seq: 0, Len: 0
    Source port: 48420 (48420)
    Destination port: http (80)
    [Stream index: 0]
    Sequence number: 0    (relative sequence number)
    Header length: 40 bytes
    Flags: 0x02 (SYN)
        000. .... .... = Reserved: Not set
        ...0 .... .... = Nonce: Not set
        .... 0... .... = Congestion Window Reduced (CWR): Not set
        .... .0.. .... = ECN-Echo: Not set
        .... ..0. .... = Urgent: Not set
        .... ...0 .... = Acknowledgement: Not set
        .... .... 0... = Push: Not set
        .... .... .0.. = Reset: Not set
        .... .... ..1. = Syn: Set
            [Expert Info (Chat/Sequence): Connection establish request (SYN): server port http]
                [Message: Connection establish request (SYN): server port http]
                [Severity level: Chat]
                [Group: Sequence]
        .... .... ...0 = Fin: Not set
    Window size: 14600
    Checksum: 0xc121 [validation disabled]
        [Good Checksum: False]
        [Bad Checksum: False]
    Options: (20 bytes)
        Maximum segment size: 1460 bytes
        TCP SACK Permitted Option: True
        Timestamps: TSval 155006, TSecr 0
        NOP
        Window scale: 7 (multiply by 128)

0000  52 54 00 12 35 02 08 00 27 b5 93 71 08 00 45 10   RT..5...'..q..E.
0010  00 3c c5 77 40 00 40 06 b4 41 0a 00 02 0f d1 02   .<.w@.@..A......
0020  e3 e1 bd 24 00 50 bb a1 98 09 00 00 00 00 a0 02   ...$.P..........
0030  39 08 c1 21 00 00 02 04 05 b4 04 02 08 0a 00 02   9..!............
0040  5d 7e 00 00 00 00 01 03 03 07                     ]~........
No.     Time        Source                Destination           Protocol Info
      2 0.001080    209.2.227.225         10.0.2.15             TCP      http > 48420 [SYN, ACK] Seq=0 Ack=1 Win=65535 Len=0 MSS=1460

Frame 2: 60 bytes on wire (480 bits), 60 bytes captured (480 bits)
    Arrival Time: Mar  1, 2013 21:08:17.682595000 EST
    Epoch Time: 1362190097.682595000 seconds
    [Time delta from previous captured frame: 0.001080000 seconds]
    [Time delta from previous displayed frame: 0.001080000 seconds]
    [Time since reference or first frame: 0.001080000 seconds]
    Frame Number: 2
    Frame Length: 60 bytes (480 bits)
    Capture Length: 60 bytes (480 bits)
    [Frame is marked: False]
    [Frame is ignored: False]
    [Protocols in frame: eth:ip:tcp]
    [Coloring Rule Name: HTTP]
    [Coloring Rule String: http || tcp.port == 80]
Ethernet II, Src: RealtekU_12:35:02 (52:54:00:12:35:02), Dst: CadmusCo_b5:93:71 (08:00:27:b5:93:71)
    Destination: CadmusCo_b5:93:71 (08:00:27:b5:93:71)
        Address: CadmusCo_b5:93:71 (08:00:27:b5:93:71)
        .... ...0 .... .... .... .... = IG bit: Individual address (unicast)
        .... ..0. .... .... .... .... = LG bit: Globally unique address (factory default)
    Source: RealtekU_12:35:02 (52:54:00:12:35:02)
        Address: RealtekU_12:35:02 (52:54:00:12:35:02)
        .... ...0 .... .... .... .... = IG bit: Individual address (unicast)
        .... ..1. .... .... .... .... = LG bit: Locally administered address (this is NOT the factory default)
    Type: IP (0x0800)
    Trailer: 0000
Internet Protocol, Src: 209.2.227.225 (209.2.227.225), Dst: 10.0.2.15 (10.0.2.15)
    Version: 4
    Header length: 20 bytes
    Differentiated Services Field: 0x00 (DSCP 0x00: Default; ECN: 0x00)
        0000 00.. = Differentiated Services Codepoint: Default (0x00)
        .... ..0. = ECN-Capable Transport (ECT): 0
        .... ...0 = ECN-CE: 0
    Total Length: 44
    Identification: 0x0083 (131)
    Flags: 0x00
        0... .... = Reserved bit: Not set
        .0.. .... = Don't fragment: Not set
        ..0. .... = More fragments: Not set
    Fragment offset: 0
    Time to live: 64
    Protocol: TCP (6)
    Header checksum: 0xb956 [correct]
        [Good: True]
        [Bad: False]
    Source: 209.2.227.225 (209.2.227.225)
    Destination: 10.0.2.15 (10.0.2.15)
Transmission Control Protocol, Src Port: http (80), Dst Port: 48420 (48420), Seq: 0, Ack: 1, Len: 0
    Source port: http (80)
    Destination port: 48420 (48420)
    [Stream index: 0]
    Sequence number: 0    (relative sequence number)
    Acknowledgement number: 1    (relative ack number)
    Header length: 24 bytes
    Flags: 0x12 (SYN, ACK)
        000. .... .... = Reserved: Not set
        ...0 .... .... = Nonce: Not set
        .... 0... .... = Congestion Window Reduced (CWR): Not set
        .... .0.. .... = ECN-Echo: Not set
        .... ..0. .... = Urgent: Not set
        .... ...1 .... = Acknowledgement: Set
        .... .... 0... = Push: Not set
        .... .... .0.. = Reset: Not set
        .... .... ..1. = Syn: Set
            [Expert Info (Chat/Sequence): Connection establish acknowledge (SYN+ACK): server port http]
                [Message: Connection establish acknowledge (SYN+ACK): server port http]
                [Severity level: Chat]
                [Group: Sequence]
        .... .... ...0 = Fin: Not set
    Window size: 65535
    Checksum: 0xdce5 [validation disabled]
        [Good Checksum: False]
        [Bad Checksum: False]
    Options: (4 bytes)
        Maximum segment size: 1460 bytes
    [SEQ/ACK analysis]
        [This is an ACK to the segment in frame: 1]
        [The RTT to ACK the segment was: 0.001080000 seconds]

0000  08 00 27 b5 93 71 52 54 00 12 35 02 08 00 45 00   ..'..qRT..5...E.
0010  00 2c 00 83 00 00 40 06 b9 56 d1 02 e3 e1 0a 00   .,....@..V......
0020  02 0f 00 50 bd 24 03 1b e6 01 bb a1 98 0a 60 12   ...P.$........`.
0030  ff ff dc e5 00 00 02 04 05 b4 00 00               ............
No.     Time        Source                Destination           Protocol Info
      3 0.001104    10.0.2.15             209.2.227.225         TCP      48420 > http [ACK] Seq=1 Ack=1 Win=14600 Len=0

Frame 3: 54 bytes on wire (432 bits), 54 bytes captured (432 bits)
    Arrival Time: Mar  1, 2013 21:08:17.682619000 EST
    Epoch Time: 1362190097.682619000 seconds
    [Time delta from previous captured frame: 0.000024000 seconds]
    [Time delta from previous displayed frame: 0.000024000 seconds]
    [Time since reference or first frame: 0.001104000 seconds]
    Frame Number: 3
    Frame Length: 54 bytes (432 bits)
    Capture Length: 54 bytes (432 bits)
    [Frame is marked: False]
    [Frame is ignored: False]
    [Protocols in frame: eth:ip:tcp]
    [Coloring Rule Name: HTTP]
    [Coloring Rule String: http || tcp.port == 80]
Ethernet II, Src: CadmusCo_b5:93:71 (08:00:27:b5:93:71), Dst: RealtekU_12:35:02 (52:54:00:12:35:02)
    Destination: RealtekU_12:35:02 (52:54:00:12:35:02)
        Address: RealtekU_12:35:02 (52:54:00:12:35:02)
        .... ...0 .... .... .... .... = IG bit: Individual address (unicast)
        .... ..1. .... .... .... .... = LG bit: Locally administered address (this is NOT the factory default)
    Source: CadmusCo_b5:93:71 (08:00:27:b5:93:71)
        Address: CadmusCo_b5:93:71 (08:00:27:b5:93:71)
        .... ...0 .... .... .... .... = IG bit: Individual address (unicast)
        .... ..0. .... .... .... .... = LG bit: Globally unique address (factory default)
    Type: IP (0x0800)
Internet Protocol, Src: 10.0.2.15 (10.0.2.15), Dst: 209.2.227.225 (209.2.227.225)
    Version: 4
    Header length: 20 bytes
    Differentiated Services Field: 0x10 (DSCP 0x04: Unknown DSCP; ECN: 0x00)
        0001 00.. = Differentiated Services Codepoint: Unknown (0x04)
        .... ..0. = ECN-Capable Transport (ECT): 0
        .... ...0 = ECN-CE: 0
    Total Length: 40
    Identification: 0xc578 (50552)
    Flags: 0x02 (Don't Fragment)
        0... .... = Reserved bit: Not set
        .1.. .... = Don't fragment: Set
        ..0. .... = More fragments: Not set
    Fragment offset: 0
    Time to live: 64
    Protocol: TCP (6)
    Header checksum: 0xb454 [correct]
        [Good: True]
        [Bad: False]
    Source: 10.0.2.15 (10.0.2.15)
    Destination: 209.2.227.225 (209.2.227.225)
Transmission Control Protocol, Src Port: 48420 (48420), Dst Port: http (80), Seq: 1, Ack: 1, Len: 0
    Source port: 48420 (48420)
    Destination port: http (80)
    [Stream index: 0]
    Sequence number: 1    (relative sequence number)
    Acknowledgement number: 1    (relative ack number)
    Header length: 20 bytes
    Flags: 0x10 (ACK)
        000. .... .... = Reserved: Not set
        ...0 .... .... = Nonce: Not set
        .... 0... .... = Congestion Window Reduced (CWR): Not set
        .... .0.. .... = ECN-Echo: Not set
        .... ..0. .... = Urgent: Not set
        .... ...1 .... = Acknowledgement: Set
        .... .... 0... = Push: Not set
        .... .... .0.. = Reset: Not set
        .... .... ..0. = Syn: Not set
        .... .... ...0 = Fin: Not set
    Window size: 14600
    Checksum: 0xc10d [validation disabled]
        [Good Checksum: False]
        [Bad Checksum: False]
    [SEQ/ACK analysis]
        [This is an ACK to the segment in frame: 2]
        [The RTT to ACK the segment was: 0.000024000 seconds]

0000  52 54 00 12 35 02 08 00 27 b5 93 71 08 00 45 10   RT..5...'..q..E.
0010  00 28 c5 78 40 00 40 06 b4 54 0a 00 02 0f d1 02   .(.x@.@..T......
0020  e3 e1 bd 24 00 50 bb a1 98 0a 03 1b e6 02 50 10   ...$.P........P.
0030  39 08 c1 0d 00 00                                 9.....
No.     Time        Source                Destination           Protocol Info
      4 3.582845    10.0.2.15             209.2.227.225         TCP      [TCP segment of a reassembled PDU]

Frame 4: 61 bytes on wire (488 bits), 61 bytes captured (488 bits)
    Arrival Time: Mar  1, 2013 21:08:21.264360000 EST
    Epoch Time: 1362190101.264360000 seconds
    [Time delta from previous captured frame: 3.581741000 seconds]
    [Time delta from previous displayed frame: 3.581741000 seconds]
    [Time since reference or first frame: 3.582845000 seconds]
    Frame Number: 4
    Frame Length: 61 bytes (488 bits)
    Capture Length: 61 bytes (488 bits)
    [Frame is marked: False]
    [Frame is ignored: False]
    [Protocols in frame: eth:ip:tcp:http]
    [Coloring Rule Name: HTTP]
    [Coloring Rule String: http || tcp.port == 80]
Ethernet II, Src: CadmusCo_b5:93:71 (08:00:27:b5:93:71), Dst: RealtekU_12:35:02 (52:54:00:12:35:02)
    Destination: RealtekU_12:35:02 (52:54:00:12:35:02)
        Address: RealtekU_12:35:02 (52:54:00:12:35:02)
        .... ...0 .... .... .... .... = IG bit: Individual address (unicast)
        .... ..1. .... .... .... .... = LG bit: Locally administered address (this is NOT the factory default)
    Source: CadmusCo_b5:93:71 (08:00:27:b5:93:71)
        Address: CadmusCo_b5:93:71 (08:00:27:b5:93:71)
        .... ...0 .... .... .... .... = IG bit: Individual address (unicast)
        .... ..0. .... .... .... .... = LG bit: Globally unique address (factory default)
    Type: IP (0x0800)
Internet Protocol, Src: 10.0.2.15 (10.0.2.15), Dst: 209.2.227.225 (209.2.227.225)
    Version: 4
    Header length: 20 bytes
    Differentiated Services Field: 0x10 (DSCP 0x04: Unknown DSCP; ECN: 0x00)
        0001 00.. = Differentiated Services Codepoint: Unknown (0x04)
        .... ..0. = ECN-Capable Transport (ECT): 0
        .... ...0 = ECN-CE: 0
    Total Length: 47
    Identification: 0xc579 (50553)
    Flags: 0x02 (Don't Fragment)
        0... .... = Reserved bit: Not set
        .1.. .... = Don't fragment: Set
        ..0. .... = More fragments: Not set
    Fragment offset: 0
    Time to live: 64
    Protocol: TCP (6)
    Header checksum: 0xb44c [correct]
        [Good: True]
        [Bad: False]
    Source: 10.0.2.15 (10.0.2.15)
    Destination: 209.2.227.225 (209.2.227.225)
Transmission Control Protocol, Src Port: 48420 (48420), Dst Port: http (80), Seq: 1, Ack: 1, Len: 7
    Source port: 48420 (48420)
    Destination port: http (80)
    [Stream index: 0]
    Sequence number: 1    (relative sequence number)
    [Next sequence number: 8    (relative sequence number)]
    Acknowledgement number: 1    (relative ack number)
    Header length: 20 bytes
    Flags: 0x18 (PSH, ACK)
        000. .... .... = Reserved: Not set
        ...0 .... .... = Nonce: Not set
        .... 0... .... = Congestion Window Reduced (CWR): Not set
        .... .0.. .... = ECN-Echo: Not set
        .... ..0. .... = Urgent: Not set
        .... ...1 .... = Acknowledgement: Set
        .... .... 1... = Push: Set
        .... .... .0.. = Reset: Not set
        .... .... ..0. = Syn: Not set
        .... .... ...0 = Fin: Not set
    Window size: 14600
    Checksum: 0xc114 [validation disabled]
        [Good Checksum: False]
        [Bad Checksum: False]
    [SEQ/ACK analysis]
        [Number of bytes in flight: 7]
    TCP segment data (7 bytes)

0000  52 54 00 12 35 02 08 00 27 b5 93 71 08 00 45 10   RT..5...'..q..E.
0010  00 2f c5 79 40 00 40 06 b4 4c 0a 00 02 0f d1 02   ./.y@.@..L......
0020  e3 e1 bd 24 00 50 bb a1 98 0a 03 1b e6 02 50 18   ...$.P........P.
0030  39 08 c1 14 00 00 47 45 54 20 2f 0d 0a            9.....GET /..
No.     Time        Source                Destination           Protocol Info
      5 3.584766    209.2.227.225         10.0.2.15             TCP      http > 48420 [ACK] Seq=1 Ack=8 Win=65535 Len=0

Frame 5: 60 bytes on wire (480 bits), 60 bytes captured (480 bits)
    Arrival Time: Mar  1, 2013 21:08:21.266281000 EST
    Epoch Time: 1362190101.266281000 seconds
    [Time delta from previous captured frame: 0.001921000 seconds]
    [Time delta from previous displayed frame: 0.001921000 seconds]
    [Time since reference or first frame: 3.584766000 seconds]
    Frame Number: 5
    Frame Length: 60 bytes (480 bits)
    Capture Length: 60 bytes (480 bits)
    [Frame is marked: False]
    [Frame is ignored: False]
    [Protocols in frame: eth:ip:tcp]
    [Coloring Rule Name: HTTP]
    [Coloring Rule String: http || tcp.port == 80]
Ethernet II, Src: RealtekU_12:35:02 (52:54:00:12:35:02), Dst: CadmusCo_b5:93:71 (08:00:27:b5:93:71)
    Destination: CadmusCo_b5:93:71 (08:00:27:b5:93:71)
        Address: CadmusCo_b5:93:71 (08:00:27:b5:93:71)
        .... ...0 .... .... .... .... = IG bit: Individual address (unicast)
        .... ..0. .... .... .... .... = LG bit: Globally unique address (factory default)
    Source: RealtekU_12:35:02 (52:54:00:12:35:02)
        Address: RealtekU_12:35:02 (52:54:00:12:35:02)
        .... ...0 .... .... .... .... = IG bit: Individual address (unicast)
        .... ..1. .... .... .... .... = LG bit: Locally administered address (this is NOT the factory default)
    Type: IP (0x0800)
    Trailer: 000000000000
Internet Protocol, Src: 209.2.227.225 (209.2.227.225), Dst: 10.0.2.15 (10.0.2.15)
    Version: 4
    Header length: 20 bytes
    Differentiated Services Field: 0x00 (DSCP 0x00: Default; ECN: 0x00)
        0000 00.. = Differentiated Services Codepoint: Default (0x00)
        .... ..0. = ECN-Capable Transport (ECT): 0
        .... ...0 = ECN-CE: 0
    Total Length: 40
    Identification: 0x0084 (132)
    Flags: 0x00
        0... .... = Reserved bit: Not set
        .0.. .... = Don't fragment: Not set
        ..0. .... = More fragments: Not set
    Fragment offset: 0
    Time to live: 64
    Protocol: TCP (6)
    Header checksum: 0xb959 [correct]
        [Good: True]
        [Bad: False]
    Source: 209.2.227.225 (209.2.227.225)
    Destination: 10.0.2.15 (10.0.2.15)
Transmission Control Protocol, Src Port: http (80), Dst Port: 48420 (48420), Seq: 1, Ack: 8, Len: 0
    Source port: http (80)
    Destination port: 48420 (48420)
    [Stream index: 0]
    Sequence number: 1    (relative sequence number)
    Acknowledgement number: 8    (relative ack number)
    Header length: 20 bytes
    Flags: 0x10 (ACK)
        000. .... .... = Reserved: Not set
        ...0 .... .... = Nonce: Not set
        .... 0... .... = Congestion Window Reduced (CWR): Not set
        .... .0.. .... = ECN-Echo: Not set
        .... ..0. .... = Urgent: Not set
        .... ...1 .... = Acknowledgement: Set
        .... .... 0... = Push: Not set
        .... .... .0.. = Reset: Not set
        .... .... ..0. = Syn: Not set
        .... .... ...0 = Fin: Not set
    Window size: 65535
    Checksum: 0xf49b [validation disabled]
        [Good Checksum: False]
        [Bad Checksum: False]
    [SEQ/ACK analysis]
        [This is an ACK to the segment in frame: 4]
        [The RTT to ACK the segment was: 0.001921000 seconds]

0000  08 00 27 b5 93 71 52 54 00 12 35 02 08 00 45 00   ..'..qRT..5...E.
0010  00 28 00 84 00 00 40 06 b9 59 d1 02 e3 e1 0a 00   .(....@..Y......
0020  02 0f 00 50 bd 24 03 1b e6 02 bb a1 98 11 50 10   ...P.$........P.
0030  ff ff f4 9b 00 00 00 00 00 00 00 00               ............
No.     Time        Source                Destination           Protocol Info
      6 4.038624    209.2.227.225         10.0.2.15             HTTP     Continuation or non-HTTP traffic

Frame 6: 1474 bytes on wire (11792 bits), 1474 bytes captured (11792 bits)
    Arrival Time: Mar  1, 2013 21:08:21.720139000 EST
    Epoch Time: 1362190101.720139000 seconds
    [Time delta from previous captured frame: 0.453858000 seconds]
    [Time delta from previous displayed frame: 0.453858000 seconds]
    [Time since reference or first frame: 4.038624000 seconds]
    Frame Number: 6
    Frame Length: 1474 bytes (11792 bits)
    Capture Length: 1474 bytes (11792 bits)
    [Frame is marked: False]
    [Frame is ignored: False]
    [Protocols in frame: eth:ip:tcp:http:data]
    [Coloring Rule Name: HTTP]
    [Coloring Rule String: http || tcp.port == 80]
Ethernet II, Src: RealtekU_12:35:02 (52:54:00:12:35:02), Dst: CadmusCo_b5:93:71 (08:00:27:b5:93:71)
    Destination: CadmusCo_b5:93:71 (08:00:27:b5:93:71)
        Address: CadmusCo_b5:93:71 (08:00:27:b5:93:71)
        .... ...0 .... .... .... .... = IG bit: Individual address (unicast)
        .... ..0. .... .... .... .... = LG bit: Globally unique address (factory default)
    Source: RealtekU_12:35:02 (52:54:00:12:35:02)
        Address: RealtekU_12:35:02 (52:54:00:12:35:02)
        .... ...0 .... .... .... .... = IG bit: Individual address (unicast)
        .... ..1. .... .... .... .... = LG bit: Locally administered address (this is NOT the factory default)
    Type: IP (0x0800)
Internet Protocol, Src: 209.2.227.225 (209.2.227.225), Dst: 10.0.2.15 (10.0.2.15)
    Version: 4
    Header length: 20 bytes
    Differentiated Services Field: 0x00 (DSCP 0x00: Default; ECN: 0x00)
        0000 00.. = Differentiated Services Codepoint: Default (0x00)
        .... ..0. = ECN-Capable Transport (ECT): 0
        .... ...0 = ECN-CE: 0
    Total Length: 1460
    Identification: 0x0085 (133)
    Flags: 0x00
        0... .... = Reserved bit: Not set
        .0.. .... = Don't fragment: Not set
        ..0. .... = More fragments: Not set
    Fragment offset: 0
    Time to live: 64
    Protocol: TCP (6)
    Header checksum: 0xb3cc [correct]
        [Good: True]
        [Bad: False]
    Source: 209.2.227.225 (209.2.227.225)
    Destination: 10.0.2.15 (10.0.2.15)
Transmission Control Protocol, Src Port: http (80), Dst Port: 48420 (48420), Seq: 1, Ack: 8, Len: 1420
    Source port: http (80)
    Destination port: 48420 (48420)
    [Stream index: 0]
    Sequence number: 1    (relative sequence number)
    [Next sequence number: 1421    (relative sequence number)]
    Acknowledgement number: 8    (relative ack number)
    Header length: 20 bytes
    Flags: 0x10 (ACK)
        000. .... .... = Reserved: Not set
        ...0 .... .... = Nonce: Not set
        .... 0... .... = Congestion Window Reduced (CWR): Not set
        .... .0.. .... = ECN-Echo: Not set
        .... ..0. .... = Urgent: Not set
        .... ...1 .... = Acknowledgement: Set
        .... .... 0... = Push: Not set
        .... .... .0.. = Reset: Not set
        .... .... ..0. = Syn: Not set
        .... .... ...0 = Fin: Not set
    Window size: 65535
    Checksum: 0x3562 [validation disabled]
        [Good Checksum: False]
        [Bad Checksum: False]
    [SEQ/ACK analysis]
        [Number of bytes in flight: 1420]
Hypertext Transfer Protocol
    Data (1420 bytes)
        Data: 3c21444f43545950452068746d6c205055424c494320222d...
        [Length: 1420]

0000  08 00 27 b5 93 71 52 54 00 12 35 02 08 00 45 00   ..'..qRT..5...E.
0010  05 b4 00 85 00 00 40 06 b3 cc d1 02 e3 e1 0a 00   ......@.........
0020  02 0f 00 50 bd 24 03 1b e6 02 bb a1 98 11 50 10   ...P.$........P.
0030  ff ff 35 62 00 00 3c 21 44 4f 43 54 59 50 45 20   ..5b..<!DOCTYPE 
0040  68 74 6d 6c 20 50 55 42 4c 49 43 20 22 2d 2f 2f   html PUBLIC "-//
0050  57 33 43 2f 2f 44 54 44 20 58 48 54 4d 4c 20 31   W3C//DTD XHTML 1
0060  2e 30 20 54 72 61 6e 73 69 74 69 6f 6e 61 6c 2f   .0 Transitional/
0070  2f 45 4e 22 0d 0a 20 20 20 20 22 68 74 74 70 3a   /EN"..    "http:
0080  2f 2f 77 77 77 2e 77 33 2e 6f 72 67 2f 54 52 2f   //www.w3.org/TR/
0090  78 68 74 6d 6c 31 2f 44 54 44 2f 78 68 74 6d 6c   xhtml1/DTD/xhtml
00a0  31 2d 74 72 61 6e 73 69 74 69 6f 6e 61 6c 2e 64   1-transitional.d
00b0  74 64 22 3e 0d 0a 3c 68 74 6d 6c 20 78 6d 6c 6e   td">..<html xmln
00c0  73 3d 22 68 74 74 70 3a 2f 2f 77 77 77 2e 77 33   s="http://www.w3
00d0  2e 6f 72 67 2f 31 39 39 39 2f 78 68 74 6d 6c 22   .org/1999/xhtml"
00e0  3e 0d 0a 3c 68 65 61 64 3e 0d 0a 3c 74 69 74 6c   >..<head>..<titl
00f0  65 3e 54 65 73 74 20 50 61 67 65 20 66 6f 72 20   e>Test Page for 
0100  41 70 61 63 68 65 20 49 6e 73 74 61 6c 6c 61 74   Apache Installat
0110  69 6f 6e 3c 2f 74 69 74 6c 65 3e 0d 0a 3c 2f 68   ion</title>..</h
0120  65 61 64 3e 0d 0a 3c 21 2d 2d 20 42 61 63 6b 67   ead>..<!-- Backg
0130  72 6f 75 6e 64 20 77 68 69 74 65 2c 20 6c 69 6e   round white, lin
0140  6b 73 20 62 6c 75 65 20 28 75 6e 76 69 73 69 74   ks blue (unvisit
0150  65 64 29 2c 20 6e 61 76 79 20 28 76 69 73 69 74   ed), navy (visit
0160  65 64 29 2c 20 72 65 64 0d 0a 28 61 63 74 69 76   ed), red..(activ
0170  65 29 20 2d 2d 3e 0d 0a 3c 62 6f 64 79 20 62 67   e) -->..<body bg
0180  63 6f 6c 6f 72 3d 22 23 46 46 46 46 46 46 22 20   color="#FFFFFF" 
0190  74 65 78 74 3d 22 23 30 30 30 30 30 30 22 20 6c   text="#000000" l
01a0  69 6e 6b 3d 22 23 30 30 30 30 46 46 22 0d 0a 76   ink="#0000FF"..v
01b0  6c 69 6e 6b 3d 22 23 30 30 30 30 38 30 22 20 61   link="#000080" a
01c0  6c 69 6e 6b 3d 22 23 46 46 30 30 30 30 22 3e 0d   link="#FF0000">.
01d0  0a 3c 70 3e 49 66 20 79 6f 75 20 63 61 6e 20 73   .<p>If you can s
01e0  65 65 20 74 68 69 73 2c 20 69 74 20 6d 65 61 6e   ee this, it mean
01f0  73 20 74 68 61 74 20 74 68 65 20 69 6e 73 74 61   s that the insta
0200  6c 6c 61 74 69 6f 6e 20 6f 66 20 74 68 65 20 3c   llation of the <
0210  61 0d 0a 68 72 65 66 3d 22 68 74 74 70 3a 2f 2f   a..href="http://
0220  77 77 77 2e 61 70 61 63 68 65 2e 6f 72 67 2f 66   www.apache.org/f
0230  6f 75 6e 64 61 74 69 6f 6e 2f 70 72 65 46 41 51   oundation/preFAQ
0240  2e 68 74 6d 6c 22 3e 41 70 61 63 68 65 20 77 65   .html">Apache we
0250  62 0d 0a 73 65 72 76 65 72 3c 2f 61 3e 20 73 6f   b..server</a> so
0260  66 74 77 61 72 65 20 6f 6e 20 74 68 69 73 20 73   ftware on this s
0270  79 73 74 65 6d 20 77 61 73 20 73 75 63 63 65 73   ystem was succes
0280  73 66 75 6c 2e 20 59 6f 75 20 6d 61 79 20 6e 6f   sful. You may no
0290  77 20 61 64 64 0d 0a 63 6f 6e 74 65 6e 74 20 74   w add..content t
02a0  6f 20 74 68 69 73 20 64 69 72 65 63 74 6f 72 79   o this directory
02b0  20 61 6e 64 20 72 65 70 6c 61 63 65 20 74 68 69    and replace thi
02c0  73 20 70 61 67 65 2e 3c 2f 70 3e 0d 0a 0d 0a 3c   s page.</p>....<
02d0  68 72 20 77 69 64 74 68 3d 22 35 30 25 22 20 73   hr width="50%" s
02e0  69 7a 65 3d 22 38 22 20 2f 3e 0d 0a 3c 68 32 20   ize="8" />..<h2 
02f0  61 6c 69 67 6e 3d 22 63 65 6e 74 65 72 22 3e 53   align="center">S
0300  65 65 69 6e 67 20 74 68 69 73 20 69 6e 73 74 65   eeing this inste
0310  61 64 20 6f 66 20 74 68 65 20 77 65 62 73 69 74   ad of the websit
0320  65 20 79 6f 75 0d 0a 65 78 70 65 63 74 65 64 3f   e you..expected?
0330  3c 2f 68 32 3e 0d 0a 0d 0a 3c 70 3e 54 68 69 73   </h2>....<p>This
0340  20 70 61 67 65 20 69 73 20 68 65 72 65 20 62 65    page is here be
0350  63 61 75 73 65 20 74 68 65 20 73 69 74 65 20 61   cause the site a
0360  64 6d 69 6e 69 73 74 72 61 74 6f 72 20 68 61 73   dministrator has
0370  20 63 68 61 6e 67 65 64 20 74 68 65 0d 0a 63 6f    changed the..co
0380  6e 66 69 67 75 72 61 74 69 6f 6e 20 6f 66 20 74   nfiguration of t
0390  68 69 73 20 77 65 62 20 73 65 72 76 65 72 2e 20   his web server. 
03a0  50 6c 65 61 73 65 20 3c 73 74 72 6f 6e 67 3e 63   Please <strong>c
03b0  6f 6e 74 61 63 74 20 74 68 65 20 70 65 72 73 6f   ontact the perso
03c0  6e 0d 0a 72 65 73 70 6f 6e 73 69 62 6c 65 20 66   n..responsible f
03d0  6f 72 20 6d 61 69 6e 74 61 69 6e 69 6e 67 20 74   or maintaining t
03e0  68 69 73 20 73 65 72 76 65 72 20 77 69 74 68 20   his server with 
03f0  71 75 65 73 74 69 6f 6e 73 2e 3c 2f 73 74 72 6f   questions.</stro
0400  6e 67 3e 0d 0a 54 68 65 20 41 70 61 63 68 65 20   ng>..The Apache 
0410  53 6f 66 74 77 61 72 65 20 46 6f 75 6e 64 61 74   Software Foundat
0420  69 6f 6e 2c 20 77 68 69 63 68 20 77 72 6f 74 65   ion, which wrote
0430  20 74 68 65 20 77 65 62 20 73 65 72 76 65 72 20    the web server 
0440  73 6f 66 74 77 61 72 65 0d 0a 74 68 69 73 20 73   software..this s
0450  69 74 65 20 61 64 6d 69 6e 69 73 74 72 61 74 6f   ite administrato
0460  72 20 69 73 20 75 73 69 6e 67 2c 20 68 61 73 20   r is using, has 
0470  6e 6f 74 68 69 6e 67 20 74 6f 20 64 6f 20 77 69   nothing to do wi
0480  74 68 0d 0a 6d 61 69 6e 74 61 69 6e 69 6e 67 20   th..maintaining 
0490  74 68 69 73 20 73 69 74 65 20 61 6e 64 20 63 61   this site and ca
04a0  6e 6e 6f 74 20 68 65 6c 70 20 72 65 73 6f 6c 76   nnot help resolv
04b0  65 20 63 6f 6e 66 69 67 75 72 61 74 69 6f 6e 0d   e configuration.
04c0  0a 69 73 73 75 65 73 2e 3c 2f 70 3e 0d 0a 0d 0a   .issues.</p>....
04d0  3c 68 72 20 77 69 64 74 68 3d 22 35 30 25 22 20   <hr width="50%" 
04e0  73 69 7a 65 3d 22 38 22 20 2f 3e 0d 0a 3c 70 3e   size="8" />..<p>
04f0  54 68 65 20 41 70 61 63 68 65 20 3c 61 20 68 72   The Apache <a hr
0500  65 66 3d 22 6d 61 6e 75 61 6c 2f 22 3e 64 6f 63   ef="manual/">doc
0510  75 6d 65 6e 74 61 74 69 6f 6e 3c 2f 61 3e 20 68   umentation</a> h
0520  61 73 20 62 65 65 6e 20 69 6e 63 6c 75 64 65 64   as been included
0530  0d 0a 77 69 74 68 20 74 68 69 73 20 64 69 73 74   ..with this dist
0540  72 69 62 75 74 69 6f 6e 2e 3c 2f 70 3e 0d 0a 0d   ribution.</p>...
0550  0a 3c 70 3e 59 6f 75 20 61 72 65 20 66 72 65 65   .<p>You are free
0560  20 74 6f 20 75 73 65 20 74 68 65 20 69 6d 61 67    to use the imag
0570  65 20 62 65 6c 6f 77 20 6f 6e 20 61 6e 20 41 70   e below on an Ap
0580  61 63 68 65 2d 70 6f 77 65 72 65 64 20 77 65 62   ache-powered web
0590  0d 0a 73 65 72 76 65 72 2e 20 54 68 61 6e 6b 73   ..server. Thanks
05a0  20 66 6f 72 20 75 73 69 6e 67 20 41 70 61 63 68    for using Apach
05b0  65 21 3c 2f 70 3e 0d 0a 0d 0a 3c 64 69 76 20 61   e!</p>....<div a
05c0  6c 69                                             li
No.     Time        Source                Destination           Protocol Info
      7 4.038666    10.0.2.15             209.2.227.225         TCP      48420 > http [ACK] Seq=8 Ack=1421 Win=17040 Len=0

Frame 7: 54 bytes on wire (432 bits), 54 bytes captured (432 bits)
    Arrival Time: Mar  1, 2013 21:08:21.720181000 EST
    Epoch Time: 1362190101.720181000 seconds
    [Time delta from previous captured frame: 0.000042000 seconds]
    [Time delta from previous displayed frame: 0.000042000 seconds]
    [Time since reference or first frame: 4.038666000 seconds]
    Frame Number: 7
    Frame Length: 54 bytes (432 bits)
    Capture Length: 54 bytes (432 bits)
    [Frame is marked: False]
    [Frame is ignored: False]
    [Protocols in frame: eth:ip:tcp]
    [Coloring Rule Name: HTTP]
    [Coloring Rule String: http || tcp.port == 80]
Ethernet II, Src: CadmusCo_b5:93:71 (08:00:27:b5:93:71), Dst: RealtekU_12:35:02 (52:54:00:12:35:02)
    Destination: RealtekU_12:35:02 (52:54:00:12:35:02)
        Address: RealtekU_12:35:02 (52:54:00:12:35:02)
        .... ...0 .... .... .... .... = IG bit: Individual address (unicast)
        .... ..1. .... .... .... .... = LG bit: Locally administered address (this is NOT the factory default)
    Source: CadmusCo_b5:93:71 (08:00:27:b5:93:71)
        Address: CadmusCo_b5:93:71 (08:00:27:b5:93:71)
        .... ...0 .... .... .... .... = IG bit: Individual address (unicast)
        .... ..0. .... .... .... .... = LG bit: Globally unique address (factory default)
    Type: IP (0x0800)
Internet Protocol, Src: 10.0.2.15 (10.0.2.15), Dst: 209.2.227.225 (209.2.227.225)
    Version: 4
    Header length: 20 bytes
    Differentiated Services Field: 0x10 (DSCP 0x04: Unknown DSCP; ECN: 0x00)
        0001 00.. = Differentiated Services Codepoint: Unknown (0x04)
        .... ..0. = ECN-Capable Transport (ECT): 0
        .... ...0 = ECN-CE: 0
    Total Length: 40
    Identification: 0xc57a (50554)
    Flags: 0x02 (Don't Fragment)
        0... .... = Reserved bit: Not set
        .1.. .... = Don't fragment: Set
        ..0. .... = More fragments: Not set
    Fragment offset: 0
    Time to live: 64
    Protocol: TCP (6)
    Header checksum: 0xb452 [correct]
        [Good: True]
        [Bad: False]
    Source: 10.0.2.15 (10.0.2.15)
    Destination: 209.2.227.225 (209.2.227.225)
Transmission Control Protocol, Src Port: 48420 (48420), Dst Port: http (80), Seq: 8, Ack: 1421, Len: 0
    Source port: 48420 (48420)
    Destination port: http (80)
    [Stream index: 0]
    Sequence number: 8    (relative sequence number)
    Acknowledgement number: 1421    (relative ack number)
    Header length: 20 bytes
    Flags: 0x10 (ACK)
        000. .... .... = Reserved: Not set
        ...0 .... .... = Nonce: Not set
        .... 0... .... = Congestion Window Reduced (CWR): Not set
        .... .0.. .... = ECN-Echo: Not set
        .... ..0. .... = Urgent: Not set
        .... ...1 .... = Acknowledgement: Set
        .... .... 0... = Push: Not set
        .... .... .0.. = Reset: Not set
        .... .... ..0. = Syn: Not set
        .... .... ...0 = Fin: Not set
    Window size: 17040
    Checksum: 0xc10d [validation disabled]
        [Good Checksum: False]
        [Bad Checksum: False]
    [SEQ/ACK analysis]
        [This is an ACK to the segment in frame: 6]
        [The RTT to ACK the segment was: 0.000042000 seconds]

0000  52 54 00 12 35 02 08 00 27 b5 93 71 08 00 45 10   RT..5...'..q..E.
0010  00 28 c5 7a 40 00 40 06 b4 52 0a 00 02 0f d1 02   .(.z@.@..R......
0020  e3 e1 bd 24 00 50 bb a1 98 11 03 1b eb 8e 50 10   ...$.P........P.
0030  42 90 c1 0d 00 00                                 B.....
No.     Time        Source                Destination           Protocol Info
      8 4.038713    209.2.227.225         10.0.2.15             HTTP     Continuation or non-HTTP traffic

Frame 8: 128 bytes on wire (1024 bits), 128 bytes captured (1024 bits)
    Arrival Time: Mar  1, 2013 21:08:21.720228000 EST
    Epoch Time: 1362190101.720228000 seconds
    [Time delta from previous captured frame: 0.000047000 seconds]
    [Time delta from previous displayed frame: 0.000047000 seconds]
    [Time since reference or first frame: 4.038713000 seconds]
    Frame Number: 8
    Frame Length: 128 bytes (1024 bits)
    Capture Length: 128 bytes (1024 bits)
    [Frame is marked: False]
    [Frame is ignored: False]
    [Protocols in frame: eth:ip:tcp:http:data]
    [Coloring Rule Name: HTTP]
    [Coloring Rule String: http || tcp.port == 80]
Ethernet II, Src: RealtekU_12:35:02 (52:54:00:12:35:02), Dst: CadmusCo_b5:93:71 (08:00:27:b5:93:71)
    Destination: CadmusCo_b5:93:71 (08:00:27:b5:93:71)
        Address: CadmusCo_b5:93:71 (08:00:27:b5:93:71)
        .... ...0 .... .... .... .... = IG bit: Individual address (unicast)
        .... ..0. .... .... .... .... = LG bit: Globally unique address (factory default)
    Source: RealtekU_12:35:02 (52:54:00:12:35:02)
        Address: RealtekU_12:35:02 (52:54:00:12:35:02)
        .... ...0 .... .... .... .... = IG bit: Individual address (unicast)
        .... ..1. .... .... .... .... = LG bit: Locally administered address (this is NOT the factory default)
    Type: IP (0x0800)
Internet Protocol, Src: 209.2.227.225 (209.2.227.225), Dst: 10.0.2.15 (10.0.2.15)
    Version: 4
    Header length: 20 bytes
    Differentiated Services Field: 0x00 (DSCP 0x00: Default; ECN: 0x00)
        0000 00.. = Differentiated Services Codepoint: Default (0x00)
        .... ..0. = ECN-Capable Transport (ECT): 0
        .... ...0 = ECN-CE: 0
    Total Length: 114
    Identification: 0x0086 (134)
    Flags: 0x00
        0... .... = Reserved bit: Not set
        .0.. .... = Don't fragment: Not set
        ..0. .... = More fragments: Not set
    Fragment offset: 0
    Time to live: 64
    Protocol: TCP (6)
    Header checksum: 0xb90d [correct]
        [Good: True]
        [Bad: False]
    Source: 209.2.227.225 (209.2.227.225)
    Destination: 10.0.2.15 (10.0.2.15)
Transmission Control Protocol, Src Port: http (80), Dst Port: 48420 (48420), Seq: 1421, Ack: 8, Len: 74
    Source port: http (80)
    Destination port: 48420 (48420)
    [Stream index: 0]
    Sequence number: 1421    (relative sequence number)
    [Next sequence number: 1495    (relative sequence number)]
    Acknowledgement number: 8    (relative ack number)
    Header length: 20 bytes
    Flags: 0x18 (PSH, ACK)
        000. .... .... = Reserved: Not set
        ...0 .... .... = Nonce: Not set
        .... 0... .... = Congestion Window Reduced (CWR): Not set
        .... .0.. .... = ECN-Echo: Not set
        .... ..0. .... = Urgent: Not set
        .... ...1 .... = Acknowledgement: Set
        .... .... 1... = Push: Set
        .... .... .0.. = Reset: Not set
        .... .... ..0. = Syn: Not set
        .... .... ...0 = Fin: Not set
    Window size: 65535
    Checksum: 0x07b5 [validation disabled]
        [Good Checksum: False]
        [Bad Checksum: False]
    [SEQ/ACK analysis]
        [Number of bytes in flight: 74]
Hypertext Transfer Protocol
    Data (74 bytes)
        Data: 676e3d2263656e746572223e3c696d67207372633d226170...
        [Length: 74]

0000  08 00 27 b5 93 71 52 54 00 12 35 02 08 00 45 00   ..'..qRT..5...E.
0010  00 72 00 86 00 00 40 06 b9 0d d1 02 e3 e1 0a 00   .r....@.........
0020  02 0f 00 50 bd 24 03 1b eb 8e bb a1 98 11 50 18   ...P.$........P.
0030  ff ff 07 b5 00 00 67 6e 3d 22 63 65 6e 74 65 72   ......gn="center
0040  22 3e 3c 69 6d 67 20 73 72 63 3d 22 61 70 61 63   "><img src="apac
0050  68 65 5f 70 62 2e 67 69 66 22 20 61 6c 74 3d 22   he_pb.gif" alt="
0060  22 20 2f 3e 3c 2f 64 69 76 3e 0d 0a 3c 2f 62 6f   " /></div>..</bo
0070  64 79 3e 0d 0a 3c 2f 68 74 6d 6c 3e 0d 0a 0d 0a   dy>..</html>....
No.     Time        Source                Destination           Protocol Info
      9 4.038719    10.0.2.15             209.2.227.225         TCP      48420 > http [ACK] Seq=8 Ack=1495 Win=17040 Len=0

Frame 9: 54 bytes on wire (432 bits), 54 bytes captured (432 bits)
    Arrival Time: Mar  1, 2013 21:08:21.720234000 EST
    Epoch Time: 1362190101.720234000 seconds
    [Time delta from previous captured frame: 0.000006000 seconds]
    [Time delta from previous displayed frame: 0.000006000 seconds]
    [Time since reference or first frame: 4.038719000 seconds]
    Frame Number: 9
    Frame Length: 54 bytes (432 bits)
    Capture Length: 54 bytes (432 bits)
    [Frame is marked: False]
    [Frame is ignored: False]
    [Protocols in frame: eth:ip:tcp]
    [Coloring Rule Name: HTTP]
    [Coloring Rule String: http || tcp.port == 80]
Ethernet II, Src: CadmusCo_b5:93:71 (08:00:27:b5:93:71), Dst: RealtekU_12:35:02 (52:54:00:12:35:02)
    Destination: RealtekU_12:35:02 (52:54:00:12:35:02)
        Address: RealtekU_12:35:02 (52:54:00:12:35:02)
        .... ...0 .... .... .... .... = IG bit: Individual address (unicast)
        .... ..1. .... .... .... .... = LG bit: Locally administered address (this is NOT the factory default)
    Source: CadmusCo_b5:93:71 (08:00:27:b5:93:71)
        Address: CadmusCo_b5:93:71 (08:00:27:b5:93:71)
        .... ...0 .... .... .... .... = IG bit: Individual address (unicast)
        .... ..0. .... .... .... .... = LG bit: Globally unique address (factory default)
    Type: IP (0x0800)
Internet Protocol, Src: 10.0.2.15 (10.0.2.15), Dst: 209.2.227.225 (209.2.227.225)
    Version: 4
    Header length: 20 bytes
    Differentiated Services Field: 0x10 (DSCP 0x04: Unknown DSCP; ECN: 0x00)
        0001 00.. = Differentiated Services Codepoint: Unknown (0x04)
        .... ..0. = ECN-Capable Transport (ECT): 0
        .... ...0 = ECN-CE: 0
    Total Length: 40
    Identification: 0xc57b (50555)
    Flags: 0x02 (Don't Fragment)
        0... .... = Reserved bit: Not set
        .1.. .... = Don't fragment: Set
        ..0. .... = More fragments: Not set
    Fragment offset: 0
    Time to live: 64
    Protocol: TCP (6)
    Header checksum: 0xb451 [correct]
        [Good: True]
        [Bad: False]
    Source: 10.0.2.15 (10.0.2.15)
    Destination: 209.2.227.225 (209.2.227.225)
Transmission Control Protocol, Src Port: 48420 (48420), Dst Port: http (80), Seq: 8, Ack: 1495, Len: 0
    Source port: 48420 (48420)
    Destination port: http (80)
    [Stream index: 0]
    Sequence number: 8    (relative sequence number)
    Acknowledgement number: 1495    (relative ack number)
    Header length: 20 bytes
    Flags: 0x10 (ACK)
        000. .... .... = Reserved: Not set
        ...0 .... .... = Nonce: Not set
        .... 0... .... = Congestion Window Reduced (CWR): Not set
        .... .0.. .... = ECN-Echo: Not set
        .... ..0. .... = Urgent: Not set
        .... ...1 .... = Acknowledgement: Set
        .... .... 0... = Push: Not set
        .... .... .0.. = Reset: Not set
        .... .... ..0. = Syn: Not set
        .... .... ...0 = Fin: Not set
    Window size: 17040
    Checksum: 0xc10d [validation disabled]
        [Good Checksum: False]
        [Bad Checksum: False]
    [SEQ/ACK analysis]
        [This is an ACK to the segment in frame: 8]
        [The RTT to ACK the segment was: 0.000006000 seconds]

0000  52 54 00 12 35 02 08 00 27 b5 93 71 08 00 45 10   RT..5...'..q..E.
0010  00 28 c5 7b 40 00 40 06 b4 51 0a 00 02 0f d1 02   .(.{@.@..Q......
0020  e3 e1 bd 24 00 50 bb a1 98 11 03 1b eb d8 50 10   ...$.P........P.
0030  42 90 c1 0d 00 00                                 B.....
No.     Time        Source                Destination           Protocol Info
     10 4.051410    209.2.227.225         10.0.2.15             TCP      http > 48420 [FIN, ACK] Seq=1495 Ack=8 Win=65535 Len=0

Frame 10: 60 bytes on wire (480 bits), 60 bytes captured (480 bits)
    Arrival Time: Mar  1, 2013 21:08:21.732925000 EST
    Epoch Time: 1362190101.732925000 seconds
    [Time delta from previous captured frame: 0.012691000 seconds]
    [Time delta from previous displayed frame: 0.012691000 seconds]
    [Time since reference or first frame: 4.051410000 seconds]
    Frame Number: 10
    Frame Length: 60 bytes (480 bits)
    Capture Length: 60 bytes (480 bits)
    [Frame is marked: False]
    [Frame is ignored: False]
    [Protocols in frame: eth:ip:tcp]
    [Coloring Rule Name: HTTP]
    [Coloring Rule String: http || tcp.port == 80]
Ethernet II, Src: RealtekU_12:35:02 (52:54:00:12:35:02), Dst: CadmusCo_b5:93:71 (08:00:27:b5:93:71)
    Destination: CadmusCo_b5:93:71 (08:00:27:b5:93:71)
        Address: CadmusCo_b5:93:71 (08:00:27:b5:93:71)
        .... ...0 .... .... .... .... = IG bit: Individual address (unicast)
        .... ..0. .... .... .... .... = LG bit: Globally unique address (factory default)
    Source: RealtekU_12:35:02 (52:54:00:12:35:02)
        Address: RealtekU_12:35:02 (52:54:00:12:35:02)
        .... ...0 .... .... .... .... = IG bit: Individual address (unicast)
        .... ..1. .... .... .... .... = LG bit: Locally administered address (this is NOT the factory default)
    Type: IP (0x0800)
    Trailer: 000000000000
Internet Protocol, Src: 209.2.227.225 (209.2.227.225), Dst: 10.0.2.15 (10.0.2.15)
    Version: 4
    Header length: 20 bytes
    Differentiated Services Field: 0x00 (DSCP 0x00: Default; ECN: 0x00)
        0000 00.. = Differentiated Services Codepoint: Default (0x00)
        .... ..0. = ECN-Capable Transport (ECT): 0
        .... ...0 = ECN-CE: 0
    Total Length: 40
    Identification: 0x0087 (135)
    Flags: 0x00
        0... .... = Reserved bit: Not set
        .0.. .... = Don't fragment: Not set
        ..0. .... = More fragments: Not set
    Fragment offset: 0
    Time to live: 64
    Protocol: TCP (6)
    Header checksum: 0xb956 [correct]
        [Good: True]
        [Bad: False]
    Source: 209.2.227.225 (209.2.227.225)
    Destination: 10.0.2.15 (10.0.2.15)
Transmission Control Protocol, Src Port: http (80), Dst Port: 48420 (48420), Seq: 1495, Ack: 8, Len: 0
    Source port: http (80)
    Destination port: 48420 (48420)
    [Stream index: 0]
    Sequence number: 1495    (relative sequence number)
    Acknowledgement number: 8    (relative ack number)
    Header length: 20 bytes
    Flags: 0x11 (FIN, ACK)
        000. .... .... = Reserved: Not set
        ...0 .... .... = Nonce: Not set
        .... 0... .... = Congestion Window Reduced (CWR): Not set
        .... .0.. .... = ECN-Echo: Not set
        .... ..0. .... = Urgent: Not set
        .... ...1 .... = Acknowledgement: Set
        .... .... 0... = Push: Not set
        .... .... .0.. = Reset: Not set
        .... .... ..0. = Syn: Not set
        .... .... ...1 = Fin: Set
            [Expert Info (Chat/Sequence): Connection finish (FIN)]
                [Message: Connection finish (FIN)]
                [Severity level: Chat]
                [Group: Sequence]
    Window size: 65535
    Checksum: 0xeec4 [validation disabled]
        [Good Checksum: False]
        [Bad Checksum: False]

0000  08 00 27 b5 93 71 52 54 00 12 35 02 08 00 45 00   ..'..qRT..5...E.
0010  00 28 00 87 00 00 40 06 b9 56 d1 02 e3 e1 0a 00   .(....@..V......
0020  02 0f 00 50 bd 24 03 1b eb d8 bb a1 98 11 50 11   ...P.$........P.
0030  ff ff ee c4 00 00 00 00 00 00 00 00               ............
No.     Time        Source                Destination           Protocol Info
     11 4.051507    10.0.2.15             209.2.227.225         TCP      48420 > http [FIN, ACK] Seq=8 Ack=1496 Win=17040 Len=0

Frame 11: 54 bytes on wire (432 bits), 54 bytes captured (432 bits)
    Arrival Time: Mar  1, 2013 21:08:21.733022000 EST
    Epoch Time: 1362190101.733022000 seconds
    [Time delta from previous captured frame: 0.000097000 seconds]
    [Time delta from previous displayed frame: 0.000097000 seconds]
    [Time since reference or first frame: 4.051507000 seconds]
    Frame Number: 11
    Frame Length: 54 bytes (432 bits)
    Capture Length: 54 bytes (432 bits)
    [Frame is marked: False]
    [Frame is ignored: False]
    [Protocols in frame: eth:ip:tcp]
    [Coloring Rule Name: HTTP]
    [Coloring Rule String: http || tcp.port == 80]
Ethernet II, Src: CadmusCo_b5:93:71 (08:00:27:b5:93:71), Dst: RealtekU_12:35:02 (52:54:00:12:35:02)
    Destination: RealtekU_12:35:02 (52:54:00:12:35:02)
        Address: RealtekU_12:35:02 (52:54:00:12:35:02)
        .... ...0 .... .... .... .... = IG bit: Individual address (unicast)
        .... ..1. .... .... .... .... = LG bit: Locally administered address (this is NOT the factory default)
    Source: CadmusCo_b5:93:71 (08:00:27:b5:93:71)
        Address: CadmusCo_b5:93:71 (08:00:27:b5:93:71)
        .... ...0 .... .... .... .... = IG bit: Individual address (unicast)
        .... ..0. .... .... .... .... = LG bit: Globally unique address (factory default)
    Type: IP (0x0800)
Internet Protocol, Src: 10.0.2.15 (10.0.2.15), Dst: 209.2.227.225 (209.2.227.225)
    Version: 4
    Header length: 20 bytes
    Differentiated Services Field: 0x10 (DSCP 0x04: Unknown DSCP; ECN: 0x00)
        0001 00.. = Differentiated Services Codepoint: Unknown (0x04)
        .... ..0. = ECN-Capable Transport (ECT): 0
        .... ...0 = ECN-CE: 0
    Total Length: 40
    Identification: 0xc57c (50556)
    Flags: 0x02 (Don't Fragment)
        0... .... = Reserved bit: Not set
        .1.. .... = Don't fragment: Set
        ..0. .... = More fragments: Not set
    Fragment offset: 0
    Time to live: 64
    Protocol: TCP (6)
    Header checksum: 0xb450 [correct]
        [Good: True]
        [Bad: False]
    Source: 10.0.2.15 (10.0.2.15)
    Destination: 209.2.227.225 (209.2.227.225)
Transmission Control Protocol, Src Port: 48420 (48420), Dst Port: http (80), Seq: 8, Ack: 1496, Len: 0
    Source port: 48420 (48420)
    Destination port: http (80)
    [Stream index: 0]
    Sequence number: 8    (relative sequence number)
    Acknowledgement number: 1496    (relative ack number)
    Header length: 20 bytes
    Flags: 0x11 (FIN, ACK)
        000. .... .... = Reserved: Not set
        ...0 .... .... = Nonce: Not set
        .... 0... .... = Congestion Window Reduced (CWR): Not set
        .... .0.. .... = ECN-Echo: Not set
        .... ..0. .... = Urgent: Not set
        .... ...1 .... = Acknowledgement: Set
        .... .... 0... = Push: Not set
        .... .... .0.. = Reset: Not set
        .... .... ..0. = Syn: Not set
        .... .... ...1 = Fin: Set
            [Expert Info (Chat/Sequence): Connection finish (FIN)]
                [Message: Connection finish (FIN)]
                [Severity level: Chat]
                [Group: Sequence]
    Window size: 17040
    Checksum: 0xc10d [validation disabled]
        [Good Checksum: False]
        [Bad Checksum: False]
    [SEQ/ACK analysis]
        [This is an ACK to the segment in frame: 10]
        [The RTT to ACK the segment was: 0.000097000 seconds]

0000  52 54 00 12 35 02 08 00 27 b5 93 71 08 00 45 10   RT..5...'..q..E.
0010  00 28 c5 7c 40 00 40 06 b4 50 0a 00 02 0f d1 02   .(.|@.@..P......
0020  e3 e1 bd 24 00 50 bb a1 98 11 03 1b eb d9 50 11   ...$.P........P.
0030  42 90 c1 0d 00 00                                 B.....
No.     Time        Source                Destination           Protocol Info
     12 4.051764    209.2.227.225         10.0.2.15             TCP      http > 48420 [ACK] Seq=1496 Ack=9 Win=65535 Len=0

Frame 12: 60 bytes on wire (480 bits), 60 bytes captured (480 bits)
    Arrival Time: Mar  1, 2013 21:08:21.733279000 EST
    Epoch Time: 1362190101.733279000 seconds
    [Time delta from previous captured frame: 0.000257000 seconds]
    [Time delta from previous displayed frame: 0.000257000 seconds]
    [Time since reference or first frame: 4.051764000 seconds]
    Frame Number: 12
    Frame Length: 60 bytes (480 bits)
    Capture Length: 60 bytes (480 bits)
    [Frame is marked: False]
    [Frame is ignored: False]
    [Protocols in frame: eth:ip:tcp]
    [Coloring Rule Name: HTTP]
    [Coloring Rule String: http || tcp.port == 80]
Ethernet II, Src: RealtekU_12:35:02 (52:54:00:12:35:02), Dst: CadmusCo_b5:93:71 (08:00:27:b5:93:71)
    Destination: CadmusCo_b5:93:71 (08:00:27:b5:93:71)
        Address: CadmusCo_b5:93:71 (08:00:27:b5:93:71)
        .... ...0 .... .... .... .... = IG bit: Individual address (unicast)
        .... ..0. .... .... .... .... = LG bit: Globally unique address (factory default)
    Source: RealtekU_12:35:02 (52:54:00:12:35:02)
        Address: RealtekU_12:35:02 (52:54:00:12:35:02)
        .... ...0 .... .... .... .... = IG bit: Individual address (unicast)
        .... ..1. .... .... .... .... = LG bit: Locally administered address (this is NOT the factory default)
    Type: IP (0x0800)
    Trailer: 000000000000
Internet Protocol, Src: 209.2.227.225 (209.2.227.225), Dst: 10.0.2.15 (10.0.2.15)
    Version: 4
    Header length: 20 bytes
    Differentiated Services Field: 0x00 (DSCP 0x00: Default; ECN: 0x00)
        0000 00.. = Differentiated Services Codepoint: Default (0x00)
        .... ..0. = ECN-Capable Transport (ECT): 0
        .... ...0 = ECN-CE: 0
    Total Length: 40
    Identification: 0x0088 (136)
    Flags: 0x00
        0... .... = Reserved bit: Not set
        .0.. .... = Don't fragment: Not set
        ..0. .... = More fragments: Not set
    Fragment offset: 0
    Time to live: 64
    Protocol: TCP (6)
    Header checksum: 0xb955 [correct]
        [Good: True]
        [Bad: False]
    Source: 209.2.227.225 (209.2.227.225)
    Destination: 10.0.2.15 (10.0.2.15)
Transmission Control Protocol, Src Port: http (80), Dst Port: 48420 (48420), Seq: 1496, Ack: 9, Len: 0
    Source port: http (80)
    Destination port: 48420 (48420)
    [Stream index: 0]
    Sequence number: 1496    (relative sequence number)
    Acknowledgement number: 9    (relative ack number)
    Header length: 20 bytes
    Flags: 0x10 (ACK)
        000. .... .... = Reserved: Not set
        ...0 .... .... = Nonce: Not set
        .... 0... .... = Congestion Window Reduced (CWR): Not set
        .... .0.. .... = ECN-Echo: Not set
        .... ..0. .... = Urgent: Not set
        .... ...1 .... = Acknowledgement: Set
        .... .... 0... = Push: Not set
        .... .... .0.. = Reset: Not set
        .... .... ..0. = Syn: Not set
        .... .... ...0 = Fin: Not set
    Window size: 65535
    Checksum: 0xeec3 [validation disabled]
        [Good Checksum: False]
        [Bad Checksum: False]
    [SEQ/ACK analysis]
        [This is an ACK to the segment in frame: 11]
        [The RTT to ACK the segment was: 0.000257000 seconds]

0000  08 00 27 b5 93 71 52 54 00 12 35 02 08 00 45 00   ..'..qRT..5...E.
0010  00 28 00 88 00 00 40 06 b9 55 d1 02 e3 e1 0a 00   .(....@..U......
0020  02 0f 00 50 bd 24 03 1b eb d9 bb a1 98 12 50 10   ...P.$........P.
0030  ff ff ee c3 00 00 00 00 00 00 00 00               ............
